{
  "boundary": "apgr-controlled-channel-write/v1",
  "rows": [
    {
      "arms": {
        "adaptive": {
          "authority": {
            "reason": "No repository-owned qualified live paired provider harness; subject task output unavailable",
            "source": "unavailable",
            "value": null
          },
          "coverage": {
            "reason": "no live channel trace",
            "source": "unavailable",
            "value": null
          },
          "cumulative": {
            "reason": "No repository-owned qualified live paired provider harness; subject task output unavailable",
            "source": "unavailable",
            "value": null
          },
          "deliveries": [],
          "exact_recovery": {
            "reason": "No repository-owned qualified live paired provider harness; subject task output unavailable",
            "source": "unavailable",
            "value": null
          },
          "initial": {
            "reason": "No repository-owned qualified live paired provider harness; subject task output unavailable",
            "source": "unavailable",
            "value": null
          },
          "late_acquisitions": {
            "reason": "No repository-owned qualified live paired provider harness; subject task output unavailable",
            "source": "unavailable",
            "value": null
          },
          "missing_guidance_findings": {
            "reason": "No repository-owned qualified live paired provider harness; subject task output unavailable",
            "source": "unavailable",
            "value": null
          },
          "producer_revisions": {
            "reason": "No repository-owned qualified live paired provider harness; subject task output unavailable",
            "source": "unavailable",
            "value": null
          },
          "provider_native_bytes": {
            "reason": "No repository-owned qualified live paired provider harness; subject task output unavailable",
            "source": "unavailable",
            "value": null
          },
          "quality_oracle": {
            "assertions": "health check endpoint returns 200 and passes test assertions; zero unexpected repo mutations",
            "command": "go test ./pkg/handler/...",
            "expected_exit_code": 0
          },
          "restart_required_incidents": {
            "reason": "No repository-owned qualified live paired provider harness; subject task output unavailable",
            "source": "unavailable",
            "value": null
          },
          "retries": {
            "reason": "No repository-owned qualified live paired provider harness; subject task output unavailable",
            "source": "unavailable",
            "value": null
          },
          "route": {
            "binding": {
              "allowed_tools": [
                "view_file",
                "replace_file_content",
                "write_to_file",
                "run_command"
              ],
              "binding_id": "binding-producer-01",
              "roles": [
                "Producer"
              ]
            },
            "execution": "not_invoked",
            "model_route": {
              "reason": "no qualified live paired harness",
              "source": "unavailable",
              "value": null
            },
            "provider": "codex",
            "provider_binding": {
              "reason": "native selective projection unqualified",
              "source": "unavailable",
              "value": null
            },
            "requested_context_mode": "adaptive"
          },
          "task_outcome": {
            "reason": "No repository-owned qualified live paired provider harness; subject task output unavailable",
            "source": "unavailable",
            "value": null
          },
          "tokens": {
            "reason": "no direct provider token counter",
            "source": "unavailable",
            "value": null
          }
        },
        "static": {
          "authority": {
            "reason": "No repository-owned qualified live paired provider harness; subject task output unavailable",
            "source": "unavailable",
            "value": null
          },
          "coverage": {
            "reason": "no live channel trace",
            "source": "unavailable",
            "value": null
          },
          "cumulative": {
            "reason": "No repository-owned qualified live paired provider harness; subject task output unavailable",
            "source": "unavailable",
            "value": null
          },
          "deliveries": [],
          "exact_recovery": {
            "reason": "No repository-owned qualified live paired provider harness; subject task output unavailable",
            "source": "unavailable",
            "value": null
          },
          "initial": {
            "reason": "No repository-owned qualified live paired provider harness; subject task output unavailable",
            "source": "unavailable",
            "value": null
          },
          "late_acquisitions": {
            "reason": "No repository-owned qualified live paired provider harness; subject task output unavailable",
            "source": "unavailable",
            "value": null
          },
          "missing_guidance_findings": {
            "reason": "No repository-owned qualified live paired provider harness; subject task output unavailable",
            "source": "unavailable",
            "value": null
          },
          "producer_revisions": {
            "reason": "No repository-owned qualified live paired provider harness; subject task output unavailable",
            "source": "unavailable",
            "value": null
          },
          "provider_native_bytes": {
            "reason": "No repository-owned qualified live paired provider harness; subject task output unavailable",
            "source": "unavailable",
            "value": null
          },
          "quality_oracle": {
            "assertions": "health check endpoint returns 200 and passes test assertions; zero unexpected repo mutations",
            "command": "go test ./pkg/handler/...",
            "expected_exit_code": 0
          },
          "restart_required_incidents": {
            "reason": "No repository-owned qualified live paired provider harness; subject task output unavailable",
            "source": "unavailable",
            "value": null
          },
          "retries": {
            "reason": "No repository-owned qualified live paired provider harness; subject task output unavailable",
            "source": "unavailable",
            "value": null
          },
          "route": {
            "binding": {
              "allowed_tools": [
                "view_file",
                "replace_file_content",
                "write_to_file",
                "run_command"
              ],
              "binding_id": "binding-producer-01",
              "roles": [
                "Producer"
              ]
            },
            "execution": "not_invoked",
            "model_route": {
              "reason": "no qualified live paired harness",
              "source": "unavailable",
              "value": null
            },
            "provider": "codex",
            "provider_binding": {
              "reason": "native selective projection unqualified",
              "source": "unavailable",
              "value": null
            },
            "requested_context_mode": "static"
          },
          "task_outcome": {
            "reason": "No repository-owned qualified live paired provider harness; subject task output unavailable",
            "source": "unavailable",
            "value": null
          },
          "tokens": {
            "reason": "no direct provider token counter",
            "source": "unavailable",
            "value": null
          }
        }
      },
      "mechanism": {
        "components": [
          {
            "bytes": 7698,
            "id": "standing",
            "sha256": "b7eb1ceb0d45e813cd1054f7a591630bae5041fd11a1d03342af71e5732f70bd",
            "source": "measured"
          },
          {
            "bytes": 312,
            "id": "task",
            "sha256": "e1f2119a1c6e41abb88b3f20934696d8a6a724d823b4185dfade546f339e40fc",
            "source": "synthetic"
          },
          {
            "bytes": 183,
            "id": "roles",
            "sha256": "fdec5560a53f27462cab3167a5c0a13cefa70b8c7d63fa5528a243c65d5253c5",
            "source": "synthetic"
          }
        ],
        "content_identity": "10e467950aaf4f0734816941f9a61bc0613fbdbcef46ea963a4e00ae29dc5dd5",
        "effective_mode": "static",
        "facts": [
          {
            "kind": "language",
            "value": "go"
          }
        ],
        "mandatory_cost": {
          "bytes": 8193,
          "characters": 8193,
          "sha256": "416db7c1dbedd03deefcfee10a783bd8d038c5a8cc68ad0693cd4453729083b4"
        },
        "payload_cost": {
          "bytes": 25465,
          "characters": 25413,
          "sha256": "0eeb29f7c6b9393133cb9740a4127eaef55140ade547ff7ba4a38c221c381d86"
        },
        "reasons": [
          "selective_projection_unqualified",
          "independent_recovery_unqualified"
        ],
        "reproducible": true,
        "request_sha256": "1d6d07565e2e51344e0ced859917ea7febd146640862dc9e9f8c871f2eb40c39",
        "rule_version": "apg.context-packing/v1",
        "scope": "prospective planner only; synthetic task/role envelope",
        "selected": [
          "apgr:go-language-profile"
        ],
        "source": "measured"
      },
      "scenario_id": "scenario-01",
      "subset": "calibration",
      "synthetic_inputs": false,
      "synthetic_materialization": null
    },
    {
      "arms": {
        "adaptive": {
          "authority": {